{
  "schemaVersion": 1,
  "name": "product-manager",
  "displayName": "Product Manager Pack",
  "description": "Product strategy, requirements, and research workflow pack.",
  "version": "0.3.0",
  "maturity": "experimental",
  "packType": "role-pack",
  "persona": "product-manager",
  "categories": ["business", "productivity", "research"],
  "skills": [
    "clarify",
    "brainstorming",
    "business-plan",
    "deep-research",
    "implementation-planning",
    "prd-authoring",
    "gh-create-issue",
    "project-documentation"
  ],
  "agents": ["explorer", "planner", "researcher"],
  "tags": ["pm", "product", "strategy"],
  "authors": [
    {
      "name": "Qiongyu Li"
    }
  ]
}
