{
  "schemaVersion": 1,
  "name": "codebase-stewardship",
  "displayName": "Codebase Stewardship Pack",
  "description": "周期性/按需的代码健康治理：深化模块、治乱删冗、定架构方向，共用 grill 对抗式对话与 openspec/glossary.md + docs/adr/ 领域沉淀。区别于 agentic-issue-delivery 的一次性 issue 交付流水线。",
  "version": "0.6.0",
  "maturity": "experimental",
  "packType": "role-pack",
  "persona": "codebase-steward",
  "categories": ["coding", "refactoring", "review"],
  "skills": [
    "improve-codebase-architecture",
    "repo-entropy-audit",
    "eng-init",
    "future-aware-architecture",
    "grill-me",
    "blind-spot-pass",
    "clarify",
    "gh-create-issue"
  ],
  "agents": ["explorer"],
  "hooks": ["large-file-guard"],
  "tags": ["architecture", "deep-modules", "entropy", "refactoring", "glossary", "adr"],
  "authors": [
    {
      "name": "danker"
    }
  ]
}
