{
  "schemaVersion": 1,
  "name": "agentic-issue-delivery",
  "displayName": "Agentic Issue Delivery Pack",
  "description": "Workflow pack for turning design-stage work into implementation-ready issues, then executing those issues through subagent-driven review and delivery gates.",
  "version": "0.16.0",
  "maturity": "experimental",
  "packType": "role-pack",
  "persona": "agentic-developer",
  "categories": ["workflow", "coding", "review"],
  "skills": [
    "stage-change-pipeline",
    "subagent-workflow",
    "risk-adaptive-cross-review",
    "diagnosing-bugs",
    "gh-create-issue",
    "clarify",
    "blind-spot-pass",
    "grill-me",
    "future-aware-architecture",
    "implementation-planning",
    "git-worktree-workflows",
    "project-documentation",
    "handoff"
  ],
  "agents": ["implementer", "reviewer", "verifier", "explorer", "monitor", "issue-scribe"],
  "hooks": ["worktree-guard", "review-gate"],
  "tags": ["github-issues", "openspec", "delivery-workflow", "small-pr"],
  "authors": [
    {
      "name": "danker"
    }
  ]
}
